{
  "$schema": "https://json-schema.org/draft/2020-12/schema",
  "$id": "https://pbs-bureau.dev/fresh-plan/schemas/work-unit.schema.json",
  "title": "Work-unit",
  "description": "Formal schema for a work-unit per D20 (work-unit kind). Work-units are tracked instances of organized work in workspace state (D7 §3). Kind-discriminated; lifecycle status enum is fixed at framework-core. Notation: JSON Schema Draft 2020-12 per D28. Layer-3 formal schema per D11. Cross-kind referential integrity (kind resolves to a registered work-unit-kind; payload conforms to that kind's extension-declared payload schema; contributing-actors / contributing-specialists resolve in workspace state) is out of scope per D28.",

  "type": "object",
  "required": [
    "id",
    "kind",
    "status",
    "payload",
    "contributing-actors",
    "contributing-specialists",
    "lifecycle"
  ],
  "additionalProperties": false,
  "properties": {
    "id": {
      "$ref": "_common.schema.json#/$defs/instance-identifier",
      "description": "Unique within the workspace (D20). Instance-identifier per D34 (admits dots; e.g., 'wu-b-plan-3.2-hennigsdorf-2024')."
    },
    "kind": {
      "$ref": "_common.schema.json#/$defs/qualified-identifier",
      "description": "Work-unit-kind identifier (D20). Open vocabulary per D29; values are extension-registered (fully-qualified)."
    },
    "status": {
      "type": "string",
      "enum": ["created", "in-progress", "paused", "completed", "abandoned"],
      "description": "Lifecycle phase. Fixed core enum (D20); extensions cannot add lifecycle states."
    },
    "payload": {
      "type": "object",
      "description": "Kind-specific content (D20). Framework doesn't validate payload shape at core; the work-unit-kind extension declaration provides a payload schema (per D29 vocabulary registration spec-ref) validated separately by the framework conformance validator (D30)."
    },
    "contributing-actors": {
      "type": "array",
      "uniqueItems": true,
      "description": "Actors operating on this work-unit, with role-tags per D9 + D13. Required slot; may be [] (sensible at status='created').",
      "items": {
        "type": "object",
        "required": ["id"],
        "additionalProperties": false,
        "properties": {
          "id": { "$ref": "_common.schema.json#/$defs/instance-identifier" },
          "role": { "$ref": "_common.schema.json#/$defs/vocabulary-identifier" }
        }
      }
    },
    "contributing-specialists": {
      "type": "array",
      "uniqueItems": true,
      "description": "Specialists operating on this work-unit, referenced by workspace.composition.specialist-bindings[].binding-id (per D34 §1.2 clarification of D30 §4). Required slot; may be [].",
      "items": { "$ref": "_common.schema.json#/$defs/instance-identifier" }
    },
    "lifecycle": {
      "type": "object",
      "required": ["created-at"],
      "additionalProperties": false,
      "description": "Timestamp markers (D20). Richer lifecycle history derivable from events filtered by this work-unit's id (D23).",
      "properties": {
        "created-at": { "type": "string", "format": "date-time" },
        "started-at": { "type": "string", "format": "date-time" },
        "completed-at": { "type": "string", "format": "date-time" }
      }
    }
  }
}
